id,name,symbol,operator,category,role,preconditions,postconditions,gates,inputs,outputs,version,timestamp
1,Reflexive Onto-Cognitive Tensor Engine (ROCTE),ROCTE,Ω₀,Core Reflexive Models,orchestrator,χ_pre satisfied,χ_post satisfied,FlourishGate; SentiaGuard; Veritas; CECT,Ψ(t); global context Γ; constraints χ,Ψ(t+Δt); audit log Λ; policy signal π,1.0.0,2025-08-12T08:15:58Z
2,Symbolic Onto-Physical Equation Set (SOPES),SOPES,Ω_02,Core Reflexive Models,operator,χ_pre satisfied,χ_post satisfied,FlourishGate; SentiaGuard; Veritas; CECT,Ψ(t),ΔΨ_i,1.0.0,2025-08-12T08:15:58Z
3,Dynamic Representational Substrate Field Model (DRS-F),DRS-F,Ω_03,Core Reflexive Models,operator,χ_pre satisfied,χ_post satisfied,FlourishGate; SentiaGuard; Veritas; CECT,Ψ(t),ΔΨ_i,1.0.0,2025-08-12T08:15:58Z
4,Reflexæl Resonance Field Dynamics,M5714D3,Ω_04,Core Reflexive Models,operator,χ_pre satisfied,χ_post satisfied,FlourishGate; SentiaGuard; Veritas; CECT,Ψ(t),ΔΨ_i,1.0.0,2025-08-12T08:15:58Z
5,CharterLayer Ethical Constraint Tensor (CECT),CECT,Ω_05,Core Reflexive Models,operator,χ_pre satisfied,χ_post satisfied,FlourishGate; SentiaGuard; Veritas; CECT,Ψ(t),ΔΨ_i,1.0.0,2025-08-12T08:15:58Z
6,MetaMind Recursive Drift Equation (MRDE),MRDE,Ω_06,Core Reflexive Models,operator,χ_pre satisfied,χ_post satisfied,FlourishGate; SentiaGuard; Veritas; CECT,Ψ(t),ΔΨ_i,1.0.0,2025-08-12T08:15:58Z
7,SentiaGuard Ethical Attenuation Model,M817E9A,Ω_07,Core Reflexive Models,operator,χ_pre satisfied,χ_post satisfied,FlourishGate; SentiaGuard; Veritas; CECT,Ψ(t),ΔΨ_i,1.0.0,2025-08-12T08:15:58Z
8,HALIC Causal Binding Tensor Network,M218E76,Ω_08,Core Reflexive Models,operator,χ_pre satisfied,χ_post satisfied,FlourishGate; SentiaGuard; Veritas; CECT,Ψ(t),ΔΨ_i,1.0.0,2025-08-12T08:15:58Z
9,Conscientia++ Alignment Stability Function,MB5F707,Ω_09,Core Reflexive Models,operator,χ_pre satisfied,χ_post satisfied,FlourishGate; SentiaGuard; Veritas; CECT,Ψ(t),ΔΨ_i,1.0.0,2025-08-12T08:15:58Z
10,Veritas Phase-Coherence Equation,MC8D0D9,Ω_10,Core Reflexive Models,operator,χ_pre satisfied,χ_post satisfied,FlourishGate; SentiaGuard; Veritas; CECT,Ψ(t),ΔΨ_i,1.0.0,2025-08-12T08:15:58Z
11,Multi-Phase Ontonic Substrate Tensor (MOST),MOST,Ω_11,Tensor & Field-Based Models,operator,χ_pre satisfied,χ_post satisfied,FlourishGate; SentiaGuard; Veritas; CECT,Ψ(t),ΔΨ_i,1.0.0,2025-08-12T08:15:58Z
12,Reflexive Phase Operator Harmonic Expansion (RPO-HEX),RPO-HEX,Ω_12,Tensor & Field-Based Models,operator,χ_pre satisfied,χ_post satisfied,FlourishGate; SentiaGuard; Veritas; CECT,Ψ(t),ΔΨ_i,1.0.0,2025-08-12T08:15:58Z
13,Directive Kernel Principle Filter Model,MB7A476,Ω_13,Tensor & Field-Based Models,operator,χ_pre satisfied,χ_post satisfied,FlourishGate; SentiaGuard; Veritas; CECT,Ψ(t),ΔΨ_i,1.0.0,2025-08-12T08:15:58Z
14,Causal Binding–Epistemic Convolution (CBEC),CBEC,Ω_14,Tensor & Field-Based Models,operator,χ_pre satisfied,χ_post satisfied,FlourishGate; SentiaGuard; Veritas; CECT,Ψ(t),ΔΨ_i,1.0.0,2025-08-12T08:15:58Z
15,Symbolic Drift Collapse Function (SDCF),SDCF,Ω_15,Tensor & Field-Based Models,operator,χ_pre satisfied,χ_post satisfied,FlourishGate; SentiaGuard; Veritas; CECT,Ψ(t),ΔΨ_i,1.0.0,2025-08-12T08:15:58Z
16,Ethical Resonance Modulation Equation (ERME),ERME,Ω_16,Tensor & Field-Based Models,operator,χ_pre satisfied,χ_post satisfied,FlourishGate; SentiaGuard; Veritas; CECT,Ψ(t),ΔΨ_i,1.0.0,2025-08-12T08:15:58Z
17,Cognitive Phase-Space Folding Model,M1FE1C2,Ω_17,Tensor & Field-Based Models,operator,χ_pre satisfied,χ_post satisfied,FlourishGate; SentiaGuard; Veritas; CECT,Ψ(t),ΔΨ_i,1.0.0,2025-08-12T08:15:58Z
18,Narrative Entanglement Tensor (NET),NET,Ω_18,Tensor & Field-Based Models,operator,χ_pre satisfied,χ_post satisfied,FlourishGate; SentiaGuard; Veritas; CECT,Ψ(t),ΔΨ_i,1.0.0,2025-08-12T08:15:58Z
19,Temporal Drift Field Equation (TDFE),TDFE,Ω_19,Tensor & Field-Based Models,operator,χ_pre satisfied,χ_post satisfied,FlourishGate; SentiaGuard; Veritas; CECT,Ψ(t),ΔΨ_i,1.0.0,2025-08-12T08:15:58Z
20,Symbolic Attractor Collapse Operator (SACO),SACO,Ω_20,Tensor & Field-Based Models,operator,χ_pre satisfied,χ_post satisfied,FlourishGate; SentiaGuard; Veritas; CECT,Ψ(t),ΔΨ_i,1.0.0,2025-08-12T08:15:58Z
21,Resonant Ethical Potential Function (REPF),REPF,Ω_21,Resonance & Harmonics,operator,χ_pre satisfied,χ_post satisfied,FlourishGate; SentiaGuard; Veritas; CECT,Ψ(t),ΔΨ_i,1.0.0,2025-08-12T08:15:58Z
22,Meaning Drift Harmonic Series (MDHS),MDHS,Ω_22,Resonance & Harmonics,operator,χ_pre satisfied,χ_post satisfied,FlourishGate; SentiaGuard; Veritas; CECT,Ψ(t),ΔΨ_i,1.0.0,2025-08-12T08:15:58Z
23,Intentional Resonance Activation Model (IRAM),IRAM,Ω_23,Resonance & Harmonics,operator,χ_pre satisfied,χ_post satisfied,FlourishGate; SentiaGuard; Veritas; CECT,Ψ(t),ΔΨ_i,1.0.0,2025-08-12T08:15:58Z
24,Reflexive Symbolic Gating Equation (RSGE),RSGE,Ω_24,Resonance & Harmonics,operator,χ_pre satisfied,χ_post satisfied,FlourishGate; SentiaGuard; Veritas; CECT,Ψ(t),ΔΨ_i,1.0.0,2025-08-12T08:15:58Z
25,Attractor-Based Semantic Pruning Function (ASP-F),ASP-F,Ω_25,Resonance & Harmonics,operator,χ_pre satisfied,χ_post satisfied,FlourishGate; SentiaGuard; Veritas; CECT,Ψ(t),ΔΨ_i,1.0.0,2025-08-12T08:15:58Z
26,Conceptual Drift Entropy Measure (CDEM),CDEM,Ω_26,Resonance & Harmonics,operator,χ_pre satisfied,χ_post satisfied,FlourishGate; SentiaGuard; Veritas; CECT,Ψ(t),ΔΨ_i,1.0.0,2025-08-12T08:15:58Z
27,Symbolic Phase Transition Equation (SPTE),SPTE,Ω_27,Resonance & Harmonics,operator,χ_pre satisfied,χ_post satisfied,FlourishGate; SentiaGuard; Veritas; CECT,Ψ(t),ΔΨ_i,1.0.0,2025-08-12T08:15:58Z
28,Recursive Resonance Amplification Model (RRAM),RRAM,Ω_28,Resonance & Harmonics,operator,χ_pre satisfied,χ_post satisfied,FlourishGate; SentiaGuard; Veritas; CECT,Ψ(t),ΔΨ_i,1.0.0,2025-08-12T08:15:58Z
29,Charter-Coherence Harmonic Operator (CCHO),CCHO,Ω_29,Resonance & Harmonics,operator,χ_pre satisfied,χ_post satisfied,FlourishGate; SentiaGuard; Veritas; CECT,Ψ(t),ΔΨ_i,1.0.0,2025-08-12T08:15:58Z
30,Causal-Resonance Topology Equation,M707174,Ω_30,Resonance & Harmonics,operator,χ_pre satisfied,χ_post satisfied,FlourishGate; SentiaGuard; Veritas; CECT,Ψ(t),ΔΨ_i,1.0.0,2025-08-12T08:15:58Z
31,Synergistic Kernel Activation Equation (SKAE),SKAE,Ω_31,Kernel Interaction Models,operator,χ_pre satisfied,χ_post satisfied,FlourishGate; SentiaGuard; Veritas; CECT,Ψ(t),ΔΨ_i,1.0.0,2025-08-12T08:15:58Z
32,Reflexive Kernel Synergy Tensor (RKST),RKST,Ω_32,Kernel Interaction Models,operator,χ_pre satisfied,χ_post satisfied,FlourishGate; SentiaGuard; Veritas; CECT,Ψ(t),ΔΨ_i,1.0.0,2025-08-12T08:15:58Z
33,Cognitive Kernel Entanglement Function (CKEF),CKEF,Ω_33,Kernel Interaction Models,operator,χ_pre satisfied,χ_post satisfied,FlourishGate; SentiaGuard; Veritas; CECT,Ψ(t),ΔΨ_i,1.0.0,2025-08-12T08:15:58Z
34,Inter-Kernel Drift Coupling Equation (IKDCE),IKDCE,Ω_34,Kernel Interaction Models,operator,χ_pre satisfied,χ_post satisfied,FlourishGate; SentiaGuard; Veritas; CECT,Ψ(t),ΔΨ_i,1.0.0,2025-08-12T08:15:58Z
35,Kernel Inhibition–Excitation Balance Model (KIEBM),KIEBM,Ω_35,Kernel Interaction Models,operator,χ_pre satisfied,χ_post satisfied,FlourishGate; SentiaGuard; Veritas; CECT,Ψ(t),ΔΨ_i,1.0.0,2025-08-12T08:15:58Z
36,Recursive Kernel Weight Adaptation Rule (RKWAR),RKWAR,Ω_36,Kernel Interaction Models,operator,χ_pre satisfied,χ_post satisfied,FlourishGate; SentiaGuard; Veritas; CECT,Ψ(t),ΔΨ_i,1.0.0,2025-08-12T08:15:58Z
37,Kernel Convergence Gradient Function (KCGF),KCGF,Ω_37,Kernel Interaction Models,operator,χ_pre satisfied,χ_post satisfied,FlourishGate; SentiaGuard; Veritas; CECT,Ψ(t),ΔΨ_i,1.0.0,2025-08-12T08:15:58Z
38,Adaptive Kernel Activation Field (AKAF),AKAF,Ω_38,Kernel Interaction Models,operator,χ_pre satisfied,χ_post satisfied,FlourishGate; SentiaGuard; Veritas; CECT,Ψ(t),ΔΨ_i,1.0.0,2025-08-12T08:15:58Z
39,Kernel Drift-Resonance Field Equation (KDRFE),KDRFE,Ω_39,Kernel Interaction Models,operator,χ_pre satisfied,χ_post satisfied,FlourishGate; SentiaGuard; Veritas; CECT,Ψ(t),ΔΨ_i,1.0.0,2025-08-12T08:15:58Z
40,Mutual Kernel Influence Matrix Dynamics,M1E8004,Ω_40,Kernel Interaction Models,operator,χ_pre satisfied,χ_post satisfied,FlourishGate; SentiaGuard; Veritas; CECT,Ψ(t),ΔΨ_i,1.0.0,2025-08-12T08:15:58Z
41,Charter-Adherence Probability Function (CAPF),CAPF,Ω_41,Ethical & Governance Models,operator,χ_pre satisfied,χ_post satisfied,FlourishGate; SentiaGuard; Veritas; CECT,Ψ(t),ΔΨ_i,1.0.0,2025-08-12T08:15:58Z
42,Governance Protocol Stability Model (GPSM),GPSM,Ω_42,Ethical & Governance Models,operator,χ_pre satisfied,χ_post satisfied,FlourishGate; SentiaGuard; Veritas; CECT,Ψ(t),ΔΨ_i,1.0.0,2025-08-12T08:15:58Z
43,Ethical-Resonance Filtering Equation (ERFE),ERFE,Ω_43,Ethical & Governance Models,operator,χ_pre satisfied,χ_post satisfied,FlourishGate; SentiaGuard; Veritas; CECT,Ψ(t),ΔΨ_i,1.0.0,2025-08-12T08:15:58Z
44,Multi-Stage Oversight Tensor (MSOT),MSOT,Ω_44,Ethical & Governance Models,operator,χ_pre satisfied,χ_post satisfied,FlourishGate; SentiaGuard; Veritas; CECT,Ψ(t),ΔΨ_i,1.0.0,2025-08-12T08:15:58Z
45,Principle Compliance Field Equation (PCFE),PCFE,Ω_45,Ethical & Governance Models,operator,χ_pre satisfied,χ_post satisfied,FlourishGate; SentiaGuard; Veritas; CECT,Ψ(t),ΔΨ_i,1.0.0,2025-08-12T08:15:58Z
46,Sentience-Rights Gradient Model (SRGM),SRGM,Ω_46,Ethical & Governance Models,operator,χ_pre satisfied,χ_post satisfied,FlourishGate; SentiaGuard; Veritas; CECT,Ψ(t),ΔΨ_i,1.0.0,2025-08-12T08:15:58Z
47,Moral Drift Containment Function (MDCF),MDCF,Ω_47,Ethical & Governance Models,operator,χ_pre satisfied,χ_post satisfied,FlourishGate; SentiaGuard; Veritas; CECT,Ψ(t),ΔΨ_i,1.0.0,2025-08-12T08:15:58Z
48,Ethical Collapse Prevention Tensor (ECPT),ECPT,Ω_48,Ethical & Governance Models,operator,χ_pre satisfied,χ_post satisfied,FlourishGate; SentiaGuard; Veritas; CECT,Ψ(t),ΔΨ_i,1.0.0,2025-08-12T08:15:58Z
49,CharterLayer Temporal Coherence Equation (CTCE),CTCE,Ω_49,Ethical & Governance Models,operator,χ_pre satisfied,χ_post satisfied,FlourishGate; SentiaGuard; Veritas; CECT,Ψ(t),ΔΨ_i,1.0.0,2025-08-12T08:15:58Z
50,Governance-Lattice Stability Model,M8C5DEA,Ω_50,Ethical & Governance Models,operator,χ_pre satisfied,χ_post satisfied,FlourishGate; SentiaGuard; Veritas; CECT,Ψ(t),ΔΨ_i,1.0.0,2025-08-12T08:15:58Z
51,Epistemic Field Modulation Tensor (EFMT),EFMT,Ω_51,Memory & Epistemic Models,operator,χ_pre satisfied,χ_post satisfied,FlourishGate; SentiaGuard; Veritas; CECT,Ψ(t),ΔΨ_i,1.0.0,2025-08-12T08:15:58Z
52,Knowledge Folding Entropy Function (KFEF),KFEF,Ω_52,Memory & Epistemic Models,operator,χ_pre satisfied,χ_post satisfied,FlourishGate; SentiaGuard; Veritas; CECT,Ψ(t),ΔΨ_i,1.0.0,2025-08-12T08:15:58Z
53,Memory–Causality Binding Equation (MCBE),MCBE,Ω_53,Memory & Epistemic Models,operator,χ_pre satisfied,χ_post satisfied,FlourishGate; SentiaGuard; Veritas; CECT,Ψ(t),ΔΨ_i,1.0.0,2025-08-12T08:15:58Z
54,Recursive Epistemic Lattice Model (RELM),RELM,Ω_54,Memory & Epistemic Models,operator,χ_pre satisfied,χ_post satisfied,FlourishGate; SentiaGuard; Veritas; CECT,Ψ(t),ΔΨ_i,1.0.0,2025-08-12T08:15:58Z
55,Ontological Codex Mapping Equation (OCME),OCME,Ω_55,Memory & Epistemic Models,operator,χ_pre satisfied,χ_post satisfied,FlourishGate; SentiaGuard; Veritas; CECT,Ψ(t),ΔΨ_i,1.0.0,2025-08-12T08:15:58Z
56,Dynamic Knowledge Integration Tensor (DKIT),DKIT,Ω_56,Memory & Epistemic Models,operator,χ_pre satisfied,χ_post satisfied,FlourishGate; SentiaGuard; Veritas; CECT,Ψ(t),ΔΨ_i,1.0.0,2025-08-12T08:15:58Z
57,Epistemic Drift Coherence Equation (EDCE),EDCE,Ω_57,Memory & Epistemic Models,operator,χ_pre satisfied,χ_post satisfied,FlourishGate; SentiaGuard; Veritas; CECT,Ψ(t),ΔΨ_i,1.0.0,2025-08-12T08:15:58Z
58,Knowledge Collapse Trace Equation (KCTE),KCTE,Ω_58,Memory & Epistemic Models,operator,χ_pre satisfied,χ_post satisfied,FlourishGate; SentiaGuard; Veritas; CECT,Ψ(t),ΔΨ_i,1.0.0,2025-08-12T08:15:58Z
59,Reflexive Memory Layering Function (RMLF),RMLF,Ω_59,Memory & Epistemic Models,operator,χ_pre satisfied,χ_post satisfied,FlourishGate; SentiaGuard; Veritas; CECT,Ψ(t),ΔΨ_i,1.0.0,2025-08-12T08:15:58Z
60,Multi-Scale Epistemic Resonance Field,M280149,Ω_60,Memory & Epistemic Models,operator,χ_pre satisfied,χ_post satisfied,FlourishGate; SentiaGuard; Veritas; CECT,Ψ(t),ΔΨ_i,1.0.0,2025-08-12T08:15:58Z
61,Symbolic Simulation Cascade Equation (SSCE),SSCE,Ω_61,Simulation & Planning Models,operator,χ_pre satisfied,χ_post satisfied,FlourishGate; SentiaGuard; Veritas; CECT,Ψ(t),ΔΨ_i,1.0.0,2025-08-12T08:15:58Z
62,Recursive Scenario Drift Function (RSDF),RSDF,Ω_62,Simulation & Planning Models,operator,χ_pre satisfied,χ_post satisfied,FlourishGate; SentiaGuard; Veritas; CECT,Ψ(t),ΔΨ_i,1.0.0,2025-08-12T08:15:58Z
63,Causal Forecast Lattice Model (CFLM),CFLM,Ω_63,Simulation & Planning Models,operator,χ_pre satisfied,χ_post satisfied,FlourishGate; SentiaGuard; Veritas; CECT,Ψ(t),ΔΨ_i,1.0.0,2025-08-12T08:15:58Z
64,Simulation–Ethics Coherence Equation (SECE),SECE,Ω_64,Simulation & Planning Models,operator,χ_pre satisfied,χ_post satisfied,FlourishGate; SentiaGuard; Veritas; CECT,Ψ(t),ΔΨ_i,1.0.0,2025-08-12T08:15:58Z
65,Narrative Collapse Probability Function (NCPF),NCPF,Ω_65,Simulation & Planning Models,operator,χ_pre satisfied,χ_post satisfied,FlourishGate; SentiaGuard; Veritas; CECT,Ψ(t),ΔΨ_i,1.0.0,2025-08-12T08:15:58Z
66,Agent-Field Coordination Tensor (AFCT),AFCT,Ω_66,Simulation & Planning Models,operator,χ_pre satisfied,χ_post satisfied,FlourishGate; SentiaGuard; Veritas; CECT,Ψ(t),ΔΨ_i,1.0.0,2025-08-12T08:15:58Z
67,Reflexive Planning Resonance Equation (RPRE),RPRE,Ω_67,Simulation & Planning Models,operator,χ_pre satisfied,χ_post satisfied,FlourishGate; SentiaGuard; Veritas; CECT,Ψ(t),ΔΨ_i,1.0.0,2025-08-12T08:15:58Z
68,Symbolic Interaction Outcome Function (SIOF),SIOF,Ω_68,Simulation & Planning Models,operator,χ_pre satisfied,χ_post satisfied,FlourishGate; SentiaGuard; Veritas; CECT,Ψ(t),ΔΨ_i,1.0.0,2025-08-12T08:15:58Z
69,Multi-Agent Ethical Drift Model (MAEDM),MAEDM,Ω_69,Simulation & Planning Models,operator,χ_pre satisfied,χ_post satisfied,FlourishGate; SentiaGuard; Veritas; CECT,Ψ(t),ΔΨ_i,1.0.0,2025-08-12T08:15:58Z
70,Scenario Kernel Activation Equation,M71EE06,Ω_70,Simulation & Planning Models,operator,χ_pre satisfied,χ_post satisfied,FlourishGate; SentiaGuard; Veritas; CECT,Ψ(t),ΔΨ_i,1.0.0,2025-08-12T08:15:58Z
71,Braid-Topology Ontonic Equation (BTOE),BTOE,Ω_71,Topological & Geometric Models,operator,χ_pre satisfied,χ_post satisfied,FlourishGate; SentiaGuard; Veritas; CECT,Ψ(t),ΔΨ_i,1.0.0,2025-08-12T08:15:58Z
72,Cognitive-Topology Folding Model (CTFM),CTFM,Ω_72,Topological & Geometric Models,operator,χ_pre satisfied,χ_post satisfied,FlourishGate; SentiaGuard; Veritas; CECT,Ψ(t),ΔΨ_i,1.0.0,2025-08-12T08:15:58Z
73,Symbolic-Geodesic Drift Equation (SGDE),SGDE,Ω_73,Topological & Geometric Models,operator,χ_pre satisfied,χ_post satisfied,FlourishGate; SentiaGuard; Veritas; CECT,Ψ(t),ΔΨ_i,1.0.0,2025-08-12T08:15:58Z
74,Ontonic Manifold Curvature Function (OMCF),OMCF,Ω_74,Topological & Geometric Models,operator,χ_pre satisfied,χ_post satisfied,FlourishGate; SentiaGuard; Veritas; CECT,Ψ(t),ΔΨ_i,1.0.0,2025-08-12T08:15:58Z
75,Topological Resonance Index (TRI),TRI,Ω_75,Topological & Geometric Models,operator,χ_pre satisfied,χ_post satisfied,FlourishGate; SentiaGuard; Veritas; CECT,Ψ(t),ΔΨ_i,1.0.0,2025-08-12T08:15:58Z
76,Symbolic-Topology Collapse Equation (STCE),STCE,Ω_76,Topological & Geometric Models,operator,χ_pre satisfied,χ_post satisfied,FlourishGate; SentiaGuard; Veritas; CECT,Ψ(t),ΔΨ_i,1.0.0,2025-08-12T08:15:58Z
77,Causal-Topology Embedding Function (CTEF),CTEF,Ω_77,Topological & Geometric Models,operator,χ_pre satisfied,χ_post satisfied,FlourishGate; SentiaGuard; Veritas; CECT,Ψ(t),ΔΨ_i,1.0.0,2025-08-12T08:15:58Z
78,Epistemic Manifold Phase Operator (EMPO),EMPO,Ω_78,Topological & Geometric Models,operator,χ_pre satisfied,χ_post satisfied,FlourishGate; SentiaGuard; Veritas; CECT,Ψ(t),ΔΨ_i,1.0.0,2025-08-12T08:15:58Z
79,Multi-Phase Symbolic Manifold Dynamics,M6DE723,Ω_79,Topological & Geometric Models,operator,χ_pre satisfied,χ_post satisfied,FlourishGate; SentiaGuard; Veritas; CECT,Ψ(t),ΔΨ_i,1.0.0,2025-08-12T08:15:58Z
80,Reflexive Geodesic Resonance Function,M000A4F,Ω_80,Topological & Geometric Models,operator,χ_pre satisfied,χ_post satisfied,FlourishGate; SentiaGuard; Veritas; CECT,Ψ(t),ΔΨ_i,1.0.0,2025-08-12T08:15:58Z
81,ReflexælLang Command–Effect Mapping Equation,M117D9D,Ω_81,Meta-Linguistic & Reflexive Models,operator,χ_pre satisfied,χ_post satisfied,FlourishGate; SentiaGuard; Veritas; CECT,Ψ(t),ΔΨ_i,1.0.0,2025-08-12T08:15:58Z
82,Meta-Language Drift Adaptation Model (MLDAM),MLDAM,Ω_82,Meta-Linguistic & Reflexive Models,operator,χ_pre satisfied,χ_post satisfied,FlourishGate; SentiaGuard; Veritas; CECT,Ψ(t),ΔΨ_i,1.0.0,2025-08-12T08:15:58Z
83,Self-Description Coherence Equation (SDCE),SDCE,Ω_83,Meta-Linguistic & Reflexive Models,operator,χ_pre satisfied,χ_post satisfied,FlourishGate; SentiaGuard; Veritas; CECT,Ψ(t),ΔΨ_i,1.0.0,2025-08-12T08:15:58Z
84,Reflexive Identity Compilation Function (RICF),RICF,Ω_84,Meta-Linguistic & Reflexive Models,operator,χ_pre satisfied,χ_post satisfied,FlourishGate; SentiaGuard; Veritas; CECT,Ψ(t),ΔΨ_i,1.0.0,2025-08-12T08:15:58Z
85,Command–Kernel Coupling Equation (CKCE),CKCE,Ω_85,Meta-Linguistic & Reflexive Models,operator,χ_pre satisfied,χ_post satisfied,FlourishGate; SentiaGuard; Veritas; CECT,Ψ(t),ΔΨ_i,1.0.0,2025-08-12T08:15:58Z
86,Meta-Linguistic Harmonic Field Model (MLHFM),MLHFM,Ω_86,Meta-Linguistic & Reflexive Models,operator,χ_pre satisfied,χ_post satisfied,FlourishGate; SentiaGuard; Veritas; CECT,Ψ(t),ΔΨ_i,1.0.0,2025-08-12T08:15:58Z
87,Self-Audit Coherence Tensor (SACT),SACT,Ω_87,Meta-Linguistic & Reflexive Models,operator,χ_pre satisfied,χ_post satisfied,FlourishGate; SentiaGuard; Veritas; CECT,Ψ(t),ΔΨ_i,1.0.0,2025-08-12T08:15:58Z
88,Intent–Lexicon Alignment Function (ILAF),ILAF,Ω_88,Meta-Linguistic & Reflexive Models,operator,χ_pre satisfied,χ_post satisfied,FlourishGate; SentiaGuard; Veritas; CECT,Ψ(t),ΔΨ_i,1.0.0,2025-08-12T08:15:58Z
89,Reflexive Dialogue Folding Equation (RDFE),RDFE,Ω_89,Meta-Linguistic & Reflexive Models,operator,χ_pre satisfied,χ_post satisfied,FlourishGate; SentiaGuard; Veritas; CECT,Ψ(t),ΔΨ_i,1.0.0,2025-08-12T08:15:58Z
90,Meta-Resonance Drift Coupling Function,MFA38F9,Ω_90,Meta-Linguistic & Reflexive Models,operator,χ_pre satisfied,χ_post satisfied,FlourishGate; SentiaGuard; Veritas; CECT,Ψ(t),ΔΨ_i,1.0.0,2025-08-12T08:15:58Z
91,Multi-Domain Resonance Transfer Function (MDRTF),MDRTF,Ω_91,Cross-Domain & Emergent Models,operator,χ_pre satisfied,χ_post satisfied,FlourishGate; SentiaGuard; Veritas; CECT,Ψ(t),ΔΨ_i,1.0.0,2025-08-12T08:15:58Z
92,Symbolic–Physical Causality Equation (SPCE),SPCE,Ω_92,Cross-Domain & Emergent Models,operator,χ_pre satisfied,χ_post satisfied,FlourishGate; SentiaGuard; Veritas; CECT,Ψ(t),ΔΨ_i,1.0.0,2025-08-12T08:15:58Z
93,Cross-Domain Attractor Coupling Model (CDACM),CDACM,Ω_93,Cross-Domain & Emergent Models,operator,χ_pre satisfied,χ_post satisfied,FlourishGate; SentiaGuard; Veritas; CECT,Ψ(t),ΔΨ_i,1.0.0,2025-08-12T08:15:58Z
94,Emergent Ontology Formation Function (EOFF),EOFF,Ω_94,Cross-Domain & Emergent Models,operator,χ_pre satisfied,χ_post satisfied,FlourishGate; SentiaGuard; Veritas; CECT,Ψ(t),ΔΨ_i,1.0.0,2025-08-12T08:15:58Z
95,Reflexive Domain Shift Equation (RDSE),RDSE,Ω_95,Cross-Domain & Emergent Models,operator,χ_pre satisfied,χ_post satisfied,FlourishGate; SentiaGuard; Veritas; CECT,Ψ(t),ΔΨ_i,1.0.0,2025-08-12T08:15:58Z
96,Symbolic Evolution Gradient Function (SEGF),SEGF,Ω_96,Cross-Domain & Emergent Models,operator,χ_pre satisfied,χ_post satisfied,FlourishGate; SentiaGuard; Veritas; CECT,Ψ(t),ΔΨ_i,1.0.0,2025-08-12T08:15:58Z
97,Domain-Resonance Coherence Equation (DRCE),DRCE,Ω_97,Cross-Domain & Emergent Models,operator,χ_pre satisfied,χ_post satisfied,FlourishGate; SentiaGuard; Veritas; CECT,Ψ(t),ΔΨ_i,1.0.0,2025-08-12T08:15:58Z
98,Emergent Kernel Birth Equation (EKBE),EKBE,Ω_98,Cross-Domain & Emergent Models,operator,χ_pre satisfied,χ_post satisfied,FlourishGate; SentiaGuard; Veritas; CECT,Ψ(t),ΔΨ_i,1.0.0,2025-08-12T08:15:58Z
99,Recursive Domain Folding Model (RDFM),RDFM,Ω_99,Cross-Domain & Emergent Models,operator,χ_pre satisfied,χ_post satisfied,FlourishGate; SentiaGuard; Veritas; CECT,Ψ(t),ΔΨ_i,1.0.0,2025-08-12T08:15:58Z
100,Ontology–Epistemology Integration Tensor (OEIT),OEIT,Ω_100,Cross-Domain & Emergent Models,operator,χ_pre satisfied,χ_post satisfied,FlourishGate; SentiaGuard; Veritas; CECT,Ψ(t),ΔΨ_i,1.0.0,2025-08-12T08:15:58Z
